{
  "$schema": "http://json-schema.org/draft-07/schema#",
  "title": "Make It Real PRD Artifact",
  "description": "Schema for the Make It Real product requirements artifact stored as prd.json.",
  "type": "object",
  "required": [
    "schemaVersion",
    "id",
    "title",
    "goals",
    "userVisibleBehavior",
    "acceptanceCriteria",
    "nonGoals"
  ],
  "properties": {
    "schemaVersion": {
      "description": "Artifact schema version emitted by the Make It Real planner.",
      "type": "string",
      "const": "1.0"
    },
    "id": {
      "description": "Stable PRD identifier referenced by work items and Blueprint review evidence.",
      "type": "string",
      "minLength": 1
    },
    "title": {
      "description": "Human-readable title for the planned product slice.",
      "type": "string",
      "minLength": 1
    },
    "goals": {
      "description": "Outcome statements the implementation must satisfy.",
      "type": "array",
      "minItems": 1,
      "items": {
        "type": "string",
        "minLength": 1
      }
    },
    "userVisibleBehavior": {
      "description": "User-observable behavior promised by the PRD.",
      "type": "array",
      "minItems": 1,
      "items": {
        "type": "string",
        "minLength": 1
      }
    },
    "acceptanceCriteria": {
      "description": "Traceable acceptance criteria used by work items and gates.",
      "type": "array",
      "minItems": 1,
      "items": {
        "type": "object",
        "required": [
          "id",
          "statement"
        ],
        "properties": {
          "id": {
            "description": "Stable acceptance criterion identifier used in prdTrace.",
            "type": "string",
            "minLength": 1
          },
          "statement": {
            "description": "The concrete behavior or evidence requirement for this criterion.",
            "type": "string",
            "minLength": 1
          }
        },
        "additionalProperties": false
      }
    },
    "nonGoals": {
      "description": "Explicitly excluded outcomes that should not be inferred during implementation.",
      "type": "array",
      "items": {
        "type": "string",
        "minLength": 1
      }
    },
    "request": {
      "description": "Original planning request text when the PRD was generated from a user prompt.",
      "type": "string",
      "minLength": 1
    }
  },
  "additionalProperties": false
}
